{
  "schema": "fg-ducs-witness-v1",
  "id": "threads_n05_b02_backpressure_all",
  "family": "threads",
  "parameters": {
    "n": 5,
    "B": 2,
    "regime": "backpressure",
    "group": "all"
  },
  "ordinary": [
    "arrival",
    "dispatch_1",
    "dispatch_2",
    "dispatch_3",
    "dispatch_4",
    "dispatch_5",
    "finish_1",
    "finish_2",
    "finish_3",
    "finish_4",
    "finish_5"
  ],
  "controllable": [
    "dispatch_1",
    "dispatch_2",
    "dispatch_3",
    "dispatch_4",
    "dispatch_5"
  ],
  "components": [
    {
      "id": "worker_1",
      "old": {
        "states": [
          "I_q0",
          "I_q1",
          "I_q2",
          "B_q0",
          "B_q1",
          "B_q2"
        ],
        "initial": "I_q0",
        "edges": [
          [
            "I_q0",
            "arrival",
            "I_q1"
          ],
          [
            "I_q1",
            "arrival",
            "I_q2"
          ],
          [
            "I_q1",
            "dispatch_1",
            "B_q0"
          ],
          [
            "I_q1",
            "dispatch_2",
            "I_q0"
          ],
          [
            "I_q1",
            "dispatch_3",
            "I_q0"
          ],
          [
            "I_q1",
            "dispatch_4",
            "I_q0"
          ],
          [
            "I_q1",
            "dispatch_5",
            "I_q0"
          ],
          [
            "I_q2",
            "dispatch_1",
            "B_q1"
          ],
          [
            "I_q2",
            "dispatch_2",
            "I_q1"
          ],
          [
            "I_q2",
            "dispatch_3",
            "I_q1"
          ],
          [
            "I_q2",
            "dispatch_4",
            "I_q1"
          ],
          [
            "I_q2",
            "dispatch_5",
            "I_q1"
          ],
          [
            "B_q0",
            "arrival",
            "B_q1"
          ],
          [
            "B_q0",
            "finish_1",
            "I_q0"
          ],
          [
            "B_q1",
            "arrival",
            "B_q2"
          ],
          [
            "B_q1",
            "dispatch_2",
            "B_q0"
          ],
          [
            "B_q1",
            "dispatch_3",
            "B_q0"
          ],
          [
            "B_q1",
            "dispatch_4",
            "B_q0"
          ],
          [
            "B_q1",
            "dispatch_5",
            "B_q0"
          ],
          [
            "B_q1",
            "finish_1",
            "I_q1"
          ],
          [
            "B_q2",
            "dispatch_2",
            "B_q1"
          ],
          [
            "B_q2",
            "dispatch_3",
            "B_q1"
          ],
          [
            "B_q2",
            "dispatch_4",
            "B_q1"
          ],
          [
            "B_q2",
            "dispatch_5",
            "B_q1"
          ],
          [
            "B_q2",
            "finish_1",
            "I_q2"
          ]
        ]
      },
      "new": {
        "states": [
          "I_q0",
          "I_q1",
          "I_q2",
          "B_q0",
          "B_q1",
          "B_q2"
        ],
        "initial": "I_q0",
        "edges": [
          [
            "I_q0",
            "arrival",
            "I_q1"
          ],
          [
            "I_q1",
            "arrival",
            "I_q2"
          ],
          [
            "I_q1",
            "dispatch_1",
            "B_q0"
          ],
          [
            "I_q1",
            "dispatch_2",
            "I_q0"
          ],
          [
            "I_q1",
            "dispatch_3",
            "I_q0"
          ],
          [
            "I_q1",
            "dispatch_4",
            "I_q0"
          ],
          [
            "I_q1",
            "dispatch_5",
            "I_q0"
          ],
          [
            "I_q2",
            "dispatch_1",
            "B_q1"
          ],
          [
            "I_q2",
            "dispatch_2",
            "I_q1"
          ],
          [
            "I_q2",
            "dispatch_3",
            "I_q1"
          ],
          [
            "I_q2",
            "dispatch_4",
            "I_q1"
          ],
          [
            "I_q2",
            "dispatch_5",
            "I_q1"
          ],
          [
            "B_q0",
            "arrival",
            "B_q1"
          ],
          [
            "B_q0",
            "finish_1",
            "I_q0"
          ],
          [
            "B_q1",
            "arrival",
            "B_q2"
          ],
          [
            "B_q1",
            "dispatch_2",
            "B_q0"
          ],
          [
            "B_q1",
            "dispatch_3",
            "B_q0"
          ],
          [
            "B_q1",
            "dispatch_4",
            "B_q0"
          ],
          [
            "B_q1",
            "dispatch_5",
            "B_q0"
          ],
          [
            "B_q1",
            "finish_1",
            "I_q1"
          ],
          [
            "B_q2",
            "dispatch_2",
            "B_q1"
          ],
          [
            "B_q2",
            "dispatch_3",
            "B_q1"
          ],
          [
            "B_q2",
            "dispatch_4",
            "B_q1"
          ],
          [
            "B_q2",
            "dispatch_5",
            "B_q1"
          ],
          [
            "B_q2",
            "finish_1",
            "I_q2"
          ]
        ]
      },
      "transfer_action": "ablation.merge.transfers",
      "transfer": {
        "I_q0": [
          "I_q0"
        ],
        "I_q1": [
          "I_q1"
        ],
        "I_q2": [
          "I_q2"
        ]
      }
    },
    {
      "id": "worker_2",
      "old": {
        "states": [
          "I",
          "B"
        ],
        "initial": "I",
        "edges": [
          [
            "I",
            "dispatch_2",
            "B"
          ],
          [
            "B",
            "finish_2",
            "I"
          ]
        ]
      },
      "new": {
        "states": [
          "I",
          "B"
        ],
        "initial": "I",
        "edges": [
          [
            "I",
            "dispatch_2",
            "B"
          ],
          [
            "B",
            "finish_2",
            "I"
          ]
        ]
      },
      "transfer_action": "ablation.merge.transfers",
      "transfer": {
        "I": [
          "I"
        ]
      }
    },
    {
      "id": "worker_3",
      "old": {
        "states": [
          "I",
          "B"
        ],
        "initial": "I",
        "edges": [
          [
            "I",
            "dispatch_3",
            "B"
          ],
          [
            "B",
            "finish_3",
            "I"
          ]
        ]
      },
      "new": {
        "states": [
          "I",
          "B"
        ],
        "initial": "I",
        "edges": [
          [
            "I",
            "dispatch_3",
            "B"
          ],
          [
            "B",
            "finish_3",
            "I"
          ]
        ]
      },
      "transfer_action": "ablation.merge.transfers",
      "transfer": {
        "I": [
          "I"
        ]
      }
    },
    {
      "id": "worker_4",
      "old": {
        "states": [
          "I",
          "B"
        ],
        "initial": "I",
        "edges": [
          [
            "I",
            "dispatch_4",
            "B"
          ],
          [
            "B",
            "finish_4",
            "I"
          ]
        ]
      },
      "new": {
        "states": [
          "I",
          "B"
        ],
        "initial": "I",
        "edges": [
          [
            "I",
            "dispatch_4",
            "B"
          ],
          [
            "B",
            "finish_4",
            "I"
          ]
        ]
      },
      "transfer_action": "ablation.merge.transfers",
      "transfer": {
        "I": [
          "I"
        ]
      }
    },
    {
      "id": "worker_5",
      "old": {
        "states": [
          "I",
          "B"
        ],
        "initial": "I",
        "edges": [
          [
            "I",
            "dispatch_5",
            "B"
          ],
          [
            "B",
            "finish_5",
            "I"
          ]
        ]
      },
      "new": {
        "states": [
          "I",
          "B"
        ],
        "initial": "I",
        "edges": [
          [
            "I",
            "dispatch_5",
            "B"
          ],
          [
            "B",
            "finish_5",
            "I"
          ]
        ]
      },
      "transfer_action": "ablation.merge.transfers",
      "transfer": {
        "I": [
          "I"
        ]
      }
    }
  ],
  "requirements": [],
  "precedence": [],
  "endpoints": {
    "old": {
      "lts": {
        "states": [
          "s0",
          "s1",
          "s2",
          "s3",
          "s4",
          "s5",
          "s6",
          "s7",
          "s8",
          "s9",
          "s10",
          "s11",
          "s12",
          "s13",
          "s14",
          "s15",
          "s16",
          "s17",
          "s18",
          "s19",
          "s20",
          "s21",
          "s22",
          "s23",
          "s24",
          "s25",
          "s26",
          "s27",
          "s28",
          "s29",
          "s30",
          "s31",
          "s32",
          "s33",
          "s34",
          "s35",
          "s36",
          "s37",
          "s38",
          "s39",
          "s40",
          "s41",
          "s42",
          "s43",
          "s44",
          "s45",
          "s46",
          "s47",
          "s48",
          "s49",
          "s50",
          "s51",
          "s52",
          "s53",
          "s54",
          "s55",
          "s56",
          "s57",
          "s58",
          "s59",
          "s60",
          "s61",
          "s62",
          "s63",
          "s64",
          "s65",
          "s66",
          "s67",